{
  "schema_version": "1",
  "lifecycle_status": "curated",
  "slug": "slide",
  "work": {
    "canonical_title": "Slide",
    "identity_status": "verified"
  },
  "source": {
    "url": "https://en.gigamic.com/index.php?controller=attachment&id_attachment=548",
    "rule_version": "gigamic-slide-01-2024",
    "revision": "gigamic-slide-rulebook-01-2024-attachment-548-accessed-2026-08-17"
  },
  "game": {
    "slug": "slide",
    "title": "Slide",
    "title_ja": "スライド",
    "title_en": "Slide",
    "description": "数字カードを4×4のグリッドへスライドして配置し、同じ数字を上下左右に隣接させて取り除きながら、最後に残る数字の合計を小さくするカードゲーム。",
    "summary": "16枚のカードを裏向きの4×4に並べ、毎ラウンド1枚ずつ同時公開。公開カードを選び、行か列の外側からスライドして4×4を復元します。最後に残った数字の合計が最も少ない人が勝ちます。",
    "min_players": 2,
    "max_players": 6,
    "play_time": 15,
    "min_age": 7,
    "published_year": 2024,
    "edition_label": "Gigamic English rulebook 01-2024",
    "language_code": "ja",
    "publisher": "Gigamic",
    "official_url": "https://en.gigamic.com/family-games/1211-slide.html",
    "source_url": "https://en.gigamic.com/index.php?controller=attachment&id_attachment=548",
    "source_revision": "gigamic-slide-rulebook-01-2024-attachment-548-accessed-2026-08-17",
    "generated_from_source_revision": "gigamic-slide-rulebook-01-2024-attachment-548-accessed-2026-08-17",
    "source_trust": "official_publisher",
    "identity_status": "verified",
    "identity_source": "https://en.gigamic.com/family-games/1211-slide.html",
    "content_review_status": "human_reviewed"
  }
}
