{
  "schema_version": "1",
  "lifecycle_status": "curated",
  "slug": "ipso",
  "work": {
    "canonical_title": "Ipso",
    "identity_status": "verified"
  },
  "source": {
    "url": "https://en.gigamic.com/index.php?controller=attachment&id_attachment=668",
    "rule_version": "gigamic-ipso-10-2025",
    "revision": "gigamic-ipso-rulebook-10-2025-attachment-668-accessed-2026-08-20"
  },
  "game": {
    "slug": "ipso",
    "title": "Ipso",
    "title_en": "Ipso",
    "description": "数字カードを4段のピラミッドに並べ、中央の2枚と交換しながら昇順の列を作って得点するカードゲーム。",
    "summary": "各プレイヤーは14枚の数字カードで5・4・3・2枚の4段ピラミッドを作り、頂点にスターカードを置きます。中央の表向きカードと交換しながら配置を改善し、昇順の列から得点します。",
    "min_players": 2,
    "max_players": 6,
    "play_time": 15,
    "min_age": 7,
    "edition_label": "Gigamic English rulebook 10-2025",
    "language_code": "ja",
    "publisher": "Gigamic",
    "official_url": "https://en.gigamic.com/family-games/1417-ipso.html",
    "source_url": "https://en.gigamic.com/index.php?controller=attachment&id_attachment=668",
    "source_revision": "gigamic-ipso-rulebook-10-2025-attachment-668-accessed-2026-08-20",
    "generated_from_source_revision": "gigamic-ipso-rulebook-10-2025-attachment-668-accessed-2026-08-20",
    "source_trust": "official_publisher",
    "identity_status": "verified",
    "identity_source": "https://www.gigamic.com/jeux-de-voyage/1425-ipso-3421276345317.html"
  }
}
