{
  "schema_version": "1",
  "lifecycle_status": "curated",
  "slug": "minna-de-ponkotsu-paint",
  "work": {
    "canonical_title": "みんなでぽんこつペイント",
    "identity_status": "verified"
  },
  "source": {
    "url": "https://hobbyjapan.games/ponkotsu_paint/",
    "rule_version": "hobbyjapan-product-page-2018",
    "revision": "hobbyjapan-ponkotsu-paint-accessed-2026-08-20"
  },
  "game": {
    "slug": "minna-de-ponkotsu-paint",
    "title": "みんなでぽんこつペイント",
    "title_en": "Minna de Ponkotsu Paint",
    "description": "お題を直線と正円だけで描き、少ない画数の人から回答者へ見せて当ててもらうお絵描きゲーム。",
    "summary": "サイコロで決めたお題を直線と正円だけで表現します。全員が描き終わったら画数が少ない人から順に回答者へ見せ、少ない画数で早く見せるか、多く描いて分かりやすくするかを競います。",
    "min_players": 2,
    "max_players": 12,
    "play_time": 10,
    "min_age": 6,
    "published_year": 2018,
    "publisher": "ホビージャパン",
    "official_url": "https://hobbyjapan.games/ponkotsu_paint/",
    "source_url": "https://hobbyjapan.games/ponkotsu_paint/",
    "source_revision": "hobbyjapan-ponkotsu-paint-accessed-2026-08-20",
    "generated_from_source_revision": "hobbyjapan-ponkotsu-paint-accessed-2026-08-20",
    "source_trust": "official_publisher",
    "identity_status": "verified",
    "identity_source": "https://hobbyjapan.games/ponkotsu_paint/"
  }
}
