{
  "schema_version": "1",
  "lifecycle_status": "curated",
  "slug": "terraforming-mars-the-dice-game",
  "work": {
    "canonical_title": "Terraforming Mars: The Dice Game",
    "identity_status": "verified"
  },
  "source": {
    "url": "https://arclightgames.jp/wp-content/uploads/2024/04/TM_DICEGAME_RULES-JPN-fix-2023Dec-for-Web-2.pdf",
    "rule_version": "arclight-revised-2nd-printing-2024-05-30",
    "revision": "arclight-revised-2nd-printing-updated-2024-05-30-accessed-2026-08-16"
  },
  "game": {
    "slug": "terraforming-mars-the-dice-game",
    "title": "Terraforming Mars: The Dice Game",
    "title_ja": "テラフォーミング・マーズ ダイスゲーム",
    "title_en": "Terraforming Mars: The Dice Game",
    "description": "専用ダイスを資源として使い、企業を発展させながら火星の酸素濃度・気温・海洋面積率を高めるカード駆動のダイスゲーム。",
    "summary": "専用ダイスで資源を作り、カードとアクションで火星を開発する軽量版。2〜4人では海洋・気温・酸素濃度の3条件のうち2つが完成すると終了に向かい、1人ゲームでは50手番以内に3条件すべての達成を目指します。",
    "min_players": 1,
    "max_players": 4,
    "play_time": 45,
    "min_age": 14,
    "published_year": 2023,
    "edition_label": "アークライト日本語版 改訂版 第2刷",
    "language_code": "ja",
    "official_url": "https://arclightgames.jp/product/826ter/",
    "source_url": "https://arclightgames.jp/wp-content/uploads/2024/04/TM_DICEGAME_RULES-JPN-fix-2023Dec-for-Web-2.pdf",
    "source_revision": "arclight-revised-2nd-printing-updated-2024-05-30-accessed-2026-08-16",
    "generated_from_source_revision": "arclight-revised-2nd-printing-updated-2024-05-30-accessed-2026-08-16",
    "source_trust": "official_publisher",
    "identity_status": "verified",
    "identity_source": "https://arclightgames.jp/product/826ter/",
    "content_review_status": "ai_draft"
  }
}
