{
  "schema_version": "1",
  "lifecycle_status": "curated",
  "slug": "raise-your-goblets",
  "work": {
    "canonical_title": "ワインと毒とゴブレット",
    "identity_status": "verified"
  },
  "source": {
    "url": "https://hobbyjapan.games/wine_poison_and_goblets/",
    "rule_version": "hobbyjapan-product-page-2016",
    "revision": "hobbyjapan-wine-poison-and-goblets-accessed-2026-08-20"
  },
  "game": {
    "slug": "raise-your-goblets",
    "title": "ワインと毒とゴブレット",
    "title_en": "Raise Your Goblets",
    "description": "ゴブレットにワイン、毒、解毒薬を入れ、覗き、交換しながら標的を倒して自分は生き延びるブラフゲーム。",
    "summary": "各プレイヤーは名家の一員となり、キャラクター能力を使いながらゴブレットへワイン・毒・解毒薬を入れたり、内容を確認したり、他人のゴブレットと交換したりします。3ラウンドの合計勝利点を競います。",
    "min_players": 2,
    "max_players": 12,
    "play_time": 30,
    "min_age": 8,
    "published_year": 2016,
    "publisher": "Horrible Games",
    "official_url": "https://hobbyjapan.games/wine_poison_and_goblets/",
    "source_url": "https://hobbyjapan.games/wine_poison_and_goblets/",
    "source_revision": "hobbyjapan-wine-poison-and-goblets-accessed-2026-08-20",
    "generated_from_source_revision": "hobbyjapan-wine-poison-and-goblets-accessed-2026-08-20",
    "source_trust": "official_publisher",
    "identity_status": "verified"
  }
}
