{
  "schema_version": "1",
  "lifecycle_status": "curated",
  "slug": "skull-king",
  "work": {
    "canonical_title": "Skull King",
    "identity_status": "verified"
  },
  "source": {
    "url": "https://www.grandpabecksgames.com/pages/skull-king",
    "rule_version": "grandpa-becks-current-en-2026-08-22",
    "revision": "grandpa-becks-current-en-rulebook-faq-accessed-2026-08-22"
  },
  "game": {
    "slug": "skull-king",
    "title": "Skull King",
    "title_ja": "スカルキング",
    "title_en": "Skull King",
    "description": "毎ラウンドの獲得トリック数を予想してビッドし、特殊カードを含むトリックテイキングで予想どおりの結果を狙う海賊テーマのカードゲーム。",
    "summary": "各ラウンドで取るトリック数を予想してビッドし、予想どおりに取ることを目指す海賊テーマのトリックテイキング。",
    "min_players": 2,
    "max_players": 8,
    "min_age": 8,
    "published_year": 2013,
    "publisher": "Grandpa Beck's Games",
    "edition_label": "Grandpa Beck's Games current edition",
    "language_code": "en",
    "official_url": "https://www.grandpabecksgames.com/products/copy-of-skull-king%C2%AE",
    "bga_url": "https://ja.boardgamearena.com/gamepanel?game=skullking",
    "source_url": "https://www.grandpabecksgames.com/pages/skull-king",
    "source_revision": "grandpa-becks-current-en-rulebook-faq-accessed-2026-08-22",
    "generated_from_source_revision": "grandpa-becks-current-en-rulebook-faq-accessed-2026-08-22",
    "source_trust": "official_publisher",
    "identity_status": "verified",
    "identity_source": "https://www.grandpabecksgames.com/products/copy-of-skull-king%C2%AE",
    "image_url": "/assets/games/skull-king/eyecatch.webp",
    "infographics": {
      "eyecatch": "/assets/games/skull-king/eyecatch.webp",
      "summary_sheet": "/assets/games/skull-king/summary-sheet.webp"
    }
  }
}
