{
  "schema_version": "1",
  "lifecycle_status": "curated",
  "slug": "flip-7-with-a-vengeance",
  "work": {
    "canonical_title": "Flip 7: With A Vengeance",
    "identity_status": "verified"
  },
  "source": {
    "url": "https://cdn.shopify.com/s/files/1/0611/3958/3198/files/26_FLIP_7_VENGEANCE_RULES_C.pdf?v=1770853610",
    "rule_version": "the-op-ruleset-edition-1",
    "revision": "the-op-ruleset-edition-1-copyright-2026-accessed-2026-08-22"
  },
  "game": {
    "slug": "flip-7-with-a-vengeance",
    "title": "Flip 7: With A Vengeance",
    "title_ja": "フリップ7:ウィズ・ア・ベンジェンス",
    "title_en": "Flip 7: With A Vengeance",
    "description": "同じ数字の重複によるバーストを避けながら得点を伸ばし、異なる数字カード7枚のFlip 7を狙うプレス・ユア・ラック。Steal・Swap・Discard・Flip Fourなど、相手へ直接干渉するカードを追加した独立型続編。",
    "summary": "HitかStayを選び、同じ数字の重複を避けながら得点を伸ばします。異なるNumber cardを7枚集めるとFlip 7となり、複数ラウンドの合計得点を競います。",
    "min_players": 3,
    "max_players": null,
    "play_time": null,
    "min_age": 8,
    "published_year": 2026,
    "edition_label": "The Op RULESET EDITION 1",
    "language_code": "en",
    "official_url": "https://theop.games/products/flip-7-with-a-vengeance",
    "source_url": "https://cdn.shopify.com/s/files/1/0611/3958/3198/files/26_FLIP_7_VENGEANCE_RULES_C.pdf?v=1770853610",
    "source_revision": "the-op-ruleset-edition-1-copyright-2026-accessed-2026-08-22",
    "generated_from_source_revision": "the-op-ruleset-edition-1-copyright-2026-accessed-2026-08-22",
    "source_trust": "official_publisher",
    "identity_status": "verified",
    "identity_source": "https://theop.games/products/flip-7-with-a-vengeance",
    "content_review_status": "ai_draft",
    "bga_url": "https://ja.boardgamearena.com/gamepanel?game=flipsevenwithavengeance"
  }
}
